{
    "schema_version":  "1.0.0",
    "registry_version":  "1.0.0",
    "canonicalization":  "RFC8785",
    "hash_algorithm":  "SHA-256",
    "numeric_profile":  {
                            "normative_domain":  "I-JSON numbers exactly representable as IEEE 754 binary64",
                            "bundled_reference_domain":  "integers from -9007199254740991 through 9007199254740991",
                            "failure_policy":  "reject unsupported or non-finite numbers before hashing"
                        },
    "contracts":  [
                      {
                          "contract_id":  "attention_item.content",
                          "object_kind":  "attention_item",
                          "schema_file":  "attention-item.schema.json",
                          "instance_pointer":  "",
                          "digest_location":  {
                                                  "kind":  "embedded",
                                                  "json_pointer":  "/content_sha256"
                                              },
                          "construction":  "rfc8785_sha256",
                          "payload_pointer":  "",
                          "excluded_json_pointers":  [
                                                         "/content_sha256"
                                                     ]
                      },
                      {
                          "contract_id":  "authority_event.content",
                          "object_kind":  "authority_event",
                          "schema_file":  "authority-event.schema.json",
                          "instance_pointer":  "",
                          "digest_location":  {
                                                  "kind":  "embedded",
                                                  "json_pointer":  "/content_sha256"
                                              },
                          "construction":  "rfc8785_sha256",
                          "payload_pointer":  "",
                          "excluded_json_pointers":  [
                                                         "/content_sha256",
                                                         "/event_root_sha256"
                                                     ]
                      },
                      {
                          "contract_id":  "authority_event.root",
                          "object_kind":  "authority_event",
                          "schema_file":  "authority-event.schema.json",
                          "instance_pointer":  "",
                          "digest_location":  {
                                                  "kind":  "embedded",
                                                  "json_pointer":  "/event_root_sha256"
                                              },
                          "construction":  "sha256_hex_concat",
                          "binary_inputs":  [
                                                {
                                                    "json_pointer":  "/prior_event_root_sha256",
                                                    "decoding":  "lowercase_hex_32_bytes"
                                                },
                                                {
                                                    "json_pointer":  "/content_sha256",
                                                    "decoding":  "lowercase_hex_32_bytes"
                                                }
                                            ]
                      },
                      {
                          "contract_id":  "current_index.content",
                          "object_kind":  "current_index",
                          "schema_file":  "current-index.schema.json",
                          "instance_pointer":  "",
                          "digest_location":  {
                                                  "kind":  "embedded",
                                                  "json_pointer":  "/content_sha256"
                                              },
                          "construction":  "rfc8785_sha256",
                          "payload_pointer":  "",
                          "excluded_json_pointers":  [
                                                         "/content_sha256"
                                                     ]
                      },
                      {
                          "contract_id":  "decision_record.content",
                          "object_kind":  "decision_record",
                          "schema_file":  "decision-record.schema.json",
                          "instance_pointer":  "",
                          "digest_location":  {
                                                  "kind":  "embedded",
                                                  "json_pointer":  "/content_sha256"
                                              },
                          "construction":  "rfc8785_sha256",
                          "payload_pointer":  "",
                          "excluded_json_pointers":  [
                                                         "/content_sha256"
                                                     ]
                      },
                      {
                          "contract_id":  "evidence_item.content",
                          "object_kind":  "evidence_item",
                          "schema_file":  "evidence.schema.json",
                          "instance_pointer":  "",
                          "digest_location":  {
                                                  "kind":  "embedded",
                                                  "json_pointer":  "/content_sha256"
                                              },
                          "construction":  "rfc8785_sha256",
                          "payload_pointer":  "",
                          "excluded_json_pointers":  [
                                                         "/content_sha256"
                                                     ]
                      },
                      {
                          "contract_id":  "formal_generation_withdrawal_command.content",
                          "object_kind":  "formal_generation_withdrawal_command",
                          "schema_file":  "formal-generation-withdrawal-command.schema.json",
                          "instance_pointer":  "",
                          "digest_location":  {
                                                  "kind":  "embedded",
                                                  "json_pointer":  "/content_sha256"
                                              },
                          "construction":  "rfc8785_sha256",
                          "payload_pointer":  "",
                          "excluded_json_pointers":  [
                                                         "/content_sha256"
                                                     ]
                      },
                      {
                          "contract_id":  "literature_source.content",
                          "object_kind":  "literature_source",
                          "schema_file":  "literature-source.schema.json",
                          "instance_pointer":  "",
                          "digest_location":  {
                                                  "kind":  "embedded",
                                                  "json_pointer":  "/content_sha256"
                                              },
                          "construction":  "rfc8785_sha256",
                          "payload_pointer":  "",
                          "excluded_json_pointers":  [
                                                         "/content_sha256"
                                                     ]
                      },
                      {
                          "contract_id":  "method_lifecycle_command.content",
                          "object_kind":  "method_lifecycle_command",
                          "schema_file":  "method-lifecycle-command.schema.json",
                          "instance_pointer":  "",
                          "digest_location":  {
                                                  "kind":  "embedded",
                                                  "json_pointer":  "/content_sha256"
                                              },
                          "construction":  "rfc8785_sha256",
                          "payload_pointer":  "",
                          "excluded_json_pointers":  [
                                                         "/content_sha256"
                                                     ]
                      },
                      {
                          "contract_id":  "method_record.definition",
                          "object_kind":  "method_record",
                          "schema_file":  "method.schema.json",
                          "instance_pointer":  "",
                          "digest_location":  {
                                                  "kind":  "embedded",
                                                  "json_pointer":  "/identity/definition_sha256"
                                              },
                          "construction":  "rfc8785_sha256",
                          "payload_pointer":  "/mathematical_definition/canonical_definition",
                          "excluded_json_pointers":  [

                                                     ]
                      },
                      {
                          "contract_id":  "method_record.content",
                          "object_kind":  "method_record",
                          "schema_file":  "method.schema.json",
                          "instance_pointer":  "",
                          "digest_location":  {